{
  "$schema": "https://json-schema.org/draft/2020-12/schema",
  "$id": "https://oneclickeb.github.io/models-hub/contract/manifest.v2.schema.json",
  "title": "Model Hub release manifest v2",
  "description": "Contrato declarativo del manifest.json v2. Las reglas RELACIONALES (entrypoint/members/sidecar_for existentes, sin artefactos huerfanos, coherencia de device/Hexagon por set, signatures vacio) NO son expresables en JSON Schema y las impone el validador puro contract/manifest_v2.py, que es la autoridad. Este schema cubre la estructura.",
  "type": "object",
  "additionalProperties": false,
  "required": ["schema_version", "release_id", "producer", "created_at", "artifacts", "sets"],
  "properties": {
    "schema_version": {"const": 2},
    "release_id": {"type": "string", "pattern": "^[A-Za-z0-9][A-Za-z0-9._-]{0,127}$"},
    "producer": {"type": "string", "minLength": 1},
    "created_at": {"type": "string", "pattern": "^\\d{4}-\\d{2}-\\d{2}T\\d{2}:\\d{2}:\\d{2}"},
    "lineage": {
      "type": "object",
      "additionalProperties": false,
      "properties": {
        "job_id": {"type": ["string", "null"]},
        "source_release_id": {"type": ["string", "null"], "pattern": "^[A-Za-z0-9][A-Za-z0-9._-]{0,127}$"}
      }
    },
    "artifacts": {
      "type": "array",
      "minItems": 1,
      "items": {"$ref": "#/$defs/artifact"}
    },
    "sets": {
      "type": "array",
      "minItems": 1,
      "items": {"$ref": "#/$defs/set"}
    },
    "signatures": {
      "type": "array",
      "maxItems": 0,
      "description": "Reservado. Debe venir vacio en esta iteracion; una firma presente se rechaza."
    }
  },
  "$defs": {
    "sha256": {"type": "string", "pattern": "^[a-f0-9]{64}$"},
    "safe_id": {"type": "string", "pattern": "^[A-Za-z0-9][A-Za-z0-9._-]{0,127}$"},
    "artifact": {
      "type": "object",
      "additionalProperties": false,
      "required": ["id", "filename", "role", "size_bytes", "sha256"],
      "properties": {
        "id": {"$ref": "#/$defs/safe_id"},
        "filename": {"type": "string", "minLength": 1, "pattern": "^[^/\\\\]+$"},
        "role": {"enum": ["source", "weights", "context", "metadata", "attestation", "labels", "report"]},
        "size_bytes": {"type": "integer", "minimum": 0},
        "sha256": {"$ref": "#/$defs/sha256"},
        "transport": {
          "type": "object",
          "additionalProperties": false,
          "properties": {
            "encrypted": {"type": "boolean"},
            "sha256_enc": {"anyOf": [{"$ref": "#/$defs/sha256"}, {"type": "null"}]}
          }
        },
        "compat": {
          "anyOf": [
            {"type": "null"},
            {
              "type": "object",
              "additionalProperties": false,
              "required": ["device", "backend", "precision"],
              "properties": {
                "device": {"type": "string", "minLength": 1},
                "hexagon_arch": {"type": ["string", "null"], "minLength": 1},
                "qairt": {"type": ["string", "null"], "minLength": 1},
                "backend": {"type": "string", "minLength": 1},
                "precision": {"type": "string", "minLength": 1},
                "layout": {"type": ["string", "null"], "minLength": 1}
              }
            }
          ]
        }
      }
    },
    "set": {
      "type": "object",
      "additionalProperties": false,
      "required": ["artifact_set", "entrypoint", "members"],
      "properties": {
        "artifact_set": {"$ref": "#/$defs/safe_id"},
        "entrypoint": {"$ref": "#/$defs/safe_id"},
        "members": {"type": "array", "minItems": 1, "items": {"$ref": "#/$defs/safe_id"}},
        "requires": {"type": "array", "items": {"$ref": "#/$defs/safe_id"}},
        "sidecar_for": {"type": "object", "additionalProperties": {"$ref": "#/$defs/safe_id"}}
      }
    }
  }
}
